{"contractVersion":"nest.worker.v1","taskRef":"task:retrieval-sufficient","worldRef":"world:alpha","taskKind":"RETRIEVAL","generation":4,"targetTurnRef":"turn:sufficient","inputVersion":"input-v2","executionStatus":"COMPLETED","semanticStatus":"SUFFICIENT","selected":[{"memoryId":"memory:decision-1","revisionId":"revision:current-1","type":"EVENT","current":true,"historical":false,"subject":"fixture-subject","scope":"fixture-scope","perspective":"fixture-perspective","conditions":["fixture-condition"],"uncertainty":"fixture-uncertainty","relations":["revision:related-1"],"sourceEntry":{"sourceRef":"source:fixture-1","locator":"fixture-locator"}}],"candidateRefs":[{"revisionRef":"revision:current-1","worldRef":"world:alpha","projectionGeneration":7,"score":0.91,"navigation":"revision:current-1"}]}
